{
  "$schema": "./managed-test-data-ui-acceptance-registry.schema.json",
  "schemaVersion": "pockethive.managed-test-data-ui-acceptance-registry/v1",
  "registryId": "managed-test-data-ui-acceptance",
  "status": "DESIGN_BASELINE",
  "assessment": {
    "designReviewGate": "G-TEAM-REVIEW-v1",
    "designReviewStatus": "PASS",
    "implementationGate": "G-M1-INTERNAL-v1",
    "implementationEvidenceStatus": "NOT_RUN",
    "releaseGate": "dataset-qualified-core",
    "releaseQualificationStatus": "NOT_RUN",
    "scopeNote": "Green covers design coherence only. No production UI, runtime, accessibility, capacity or release behaviour is claimed."
  },
  "parentRequirement": "FUN-014",
  "sources": {
    "lifecycleSpec": "managed-test-data-lifecycle-generic-spec.md#28-acceptance-criteria",
    "uiSpec": "managed-datasets-operator-ui-design-spec.md#20-acceptance-requirements",
    "assuranceStrategy": "managed-test-data-assurance-strategy.md#7-risk-based-exploratory-charters"
  },
  "requirements": [
    {
      "id": "DSUI-DATA-001",
      "evidenceOwner": "UI_DELIVERY_OWNER",
      "parent": "FUN-014",
      "sourceSection": "managed-datasets-operator-ui-design-spec.md#20-acceptance-requirements",
      "category": "DATA",
      "applicability": "REQUIRED_CORE",
      "minimumConfidenceGrade": 4,
      "primaryCharter": "CH-34",
      "supportingCharters": ["CH-35", "CH-39"],
      "risks": ["R-SSOT-DRIFT", "R-UI-FALSE-STATE"],
      "oracleIds": ["OR-REGISTRY", "OR-UI"],
      "releaseGateIds": ["dataset-qualified-core"],
      "evidenceState": {
        "designReviewGate": "G-TEAM-REVIEW-v1",
        "designReviewStatus": "PASS",
        "designEvidenceRefs": ["managed-test-data-readiness-assessment.md#ui-design-review"],
        "implementationGate": "G-M1-INTERNAL-v1",
        "implementationStatus": "NOT_RUN",
        "implementationEvidenceRefs": [],
        "releaseGate": "dataset-qualified-core",
        "releaseStatus": "NOT_RUN",
        "releaseEvidenceRefs": []
      }
    },
    {
      "id": "DSUI-DATA-002",
      "evidenceOwner": "UI_DELIVERY_OWNER",
      "parent": "FUN-014",
      "sourceSection": "managed-datasets-operator-ui-design-spec.md#20-acceptance-requirements",
      "category": "DATA",
      "applicability": "REQUIRED_CORE",
      "minimumConfidenceGrade": 3,
      "primaryCharter": "CH-34",
      "supportingCharters": [],
      "risks": ["R-SSOT-DRIFT", "R-UI-FALSE-STATE"],
      "oracleIds": ["OR-REGISTRY"],
      "releaseGateIds": ["dataset-qualified-core"],
      "evidenceState": {
        "designReviewGate": "G-TEAM-REVIEW-v1",
        "designReviewStatus": "PASS",
        "designEvidenceRefs": ["managed-test-data-readiness-assessment.md#ui-design-review"],
        "implementationGate": "G-M1-INTERNAL-v1",
        "implementationStatus": "NOT_RUN",
        "implementationEvidenceRefs": [],
        "releaseGate": "dataset-qualified-core",
        "releaseStatus": "NOT_RUN",
        "releaseEvidenceRefs": []
      }
    },
    {
      "id": "DSUI-DATA-003",
      "evidenceOwner": "UI_DELIVERY_OWNER",
      "parent": "FUN-014",
      "sourceSection": "managed-datasets-operator-ui-design-spec.md#20-acceptance-requirements",
      "category": "DATA",
      "applicability": "REQUIRED_CORE",
      "minimumConfidenceGrade": 3,
      "primaryCharter": "CH-34",
      "supportingCharters": ["CH-36"],
      "risks": ["R-SSOT-DRIFT", "R-UI-FALSE-STATE"],
      "oracleIds": ["OR-REGISTRY", "OR-PG", "OR-EXT-EFFECT"],
      "releaseGateIds": ["dataset-qualified-core"],
      "evidenceState": {
        "designReviewGate": "G-TEAM-REVIEW-v1",
        "designReviewStatus": "PASS",
        "designEvidenceRefs": ["managed-test-data-readiness-assessment.md#ui-design-review"],
        "implementationGate": "G-M1-INTERNAL-v1",
        "implementationStatus": "NOT_RUN",
        "implementationEvidenceRefs": [],
        "releaseGate": "dataset-qualified-core",
        "releaseStatus": "NOT_RUN",
        "releaseEvidenceRefs": []
      }
    },
    {
      "id": "DSUI-DATA-004",
      "evidenceOwner": "UI_DELIVERY_OWNER",
      "parent": "FUN-014",
      "sourceSection": "managed-datasets-operator-ui-design-spec.md#20-acceptance-requirements",
      "category": "DATA",
      "applicability": "REQUIRED_CORE",
      "minimumConfidenceGrade": 4,
      "primaryCharter": "CH-34",
      "supportingCharters": ["CH-35", "CH-39"],
      "risks": ["R-UI-FALSE-STATE", "R-UI-STALE"],
      "oracleIds": ["OR-REGISTRY", "OR-UI"],
      "releaseGateIds": ["dataset-qualified-core"],
      "evidenceState": {
        "designReviewGate": "G-TEAM-REVIEW-v1",
        "designReviewStatus": "PASS",
        "designEvidenceRefs": ["managed-test-data-readiness-assessment.md#ui-design-review"],
        "implementationGate": "G-M1-INTERNAL-v1",
        "implementationStatus": "NOT_RUN",
        "implementationEvidenceRefs": [],
        "releaseGate": "dataset-qualified-core",
        "releaseStatus": "NOT_RUN",
        "releaseEvidenceRefs": []
      }
    },
    {
      "id": "DSUI-ARCH-001",
      "evidenceOwner": "ARCHITECTURE_OWNER",
      "parent": "FUN-014",
      "sourceSection": "managed-datasets-operator-ui-design-spec.md#20-acceptance-requirements",
      "category": "ARCH",
      "applicability": "REQUIRED_CORE",
      "minimumConfidenceGrade": 4,
      "primaryCharter": "CH-36",
      "supportingCharters": ["CH-34"],
      "risks": ["R-SCOPE", "R-UI-SCOPE-LEAK"],
      "oracleIds": ["OR-AUTHZ", "OR-UI"],
      "releaseGateIds": ["dataset-qualified-core"],
      "evidenceState": {
        "designReviewGate": "G-TEAM-REVIEW-v1",
        "designReviewStatus": "PASS",
        "designEvidenceRefs": ["managed-test-data-readiness-assessment.md#ui-design-review"],
        "implementationGate": "G-M1-INTERNAL-v1",
        "implementationStatus": "NOT_RUN",
        "implementationEvidenceRefs": [],
        "releaseGate": "dataset-qualified-core",
        "releaseStatus": "NOT_RUN",
        "releaseEvidenceRefs": []
      }
    },
    {
      "id": "DSUI-ARCH-002",
      "evidenceOwner": "ARCHITECTURE_OWNER",
      "parent": "FUN-014",
      "sourceSection": "managed-datasets-operator-ui-design-spec.md#20-acceptance-requirements",
      "category": "ARCH",
      "applicability": "REQUIRED_CORE",
      "minimumConfidenceGrade": 5,
      "primaryCharter": "CH-38",
      "supportingCharters": ["CH-34"],
      "risks": ["R-UI-LOAD", "R-CONTROL-DOS"],
      "oracleIds": ["OR-PG", "OR-RESOURCE"],
      "releaseGateIds": ["dataset-qualified-core"],
      "evidenceState": {
        "designReviewGate": "G-TEAM-REVIEW-v1",
        "designReviewStatus": "PASS",
        "designEvidenceRefs": ["managed-test-data-readiness-assessment.md#ui-design-review"],
        "implementationGate": "G-M1-INTERNAL-v1",
        "implementationStatus": "NOT_RUN",
        "implementationEvidenceRefs": [],
        "releaseGate": "dataset-qualified-core",
        "releaseStatus": "NOT_RUN",
        "releaseEvidenceRefs": []
      }
    },
    {
      "id": "DSUI-ARCH-003",
      "evidenceOwner": "ARCHITECTURE_OWNER",
      "parent": "FUN-014",
      "sourceSection": "managed-datasets-operator-ui-design-spec.md#20-acceptance-requirements",
      "category": "ARCH",
      "applicability": "REQUIRED_CORE",
      "minimumConfidenceGrade": 4,
      "primaryCharter": "CH-35",
      "supportingCharters": ["CH-34", "CH-39"],
      "risks": ["R-SSOT-DRIFT", "R-UI-FALSE-STATE", "R-UI-STALE"],
      "oracleIds": ["OR-PG", "OR-UI", "OR-WORKER-SINK"],
      "releaseGateIds": ["dataset-qualified-core"],
      "evidenceState": {
        "designReviewGate": "G-TEAM-REVIEW-v1",
        "designReviewStatus": "PASS",
        "designEvidenceRefs": ["managed-test-data-readiness-assessment.md#ui-design-review"],
        "implementationGate": "G-M1-INTERNAL-v1",
        "implementationStatus": "NOT_RUN",
        "implementationEvidenceRefs": [],
        "releaseGate": "dataset-qualified-core",
        "releaseStatus": "NOT_RUN",
        "releaseEvidenceRefs": []
      }
    },
    {
      "id": "DSUI-ARCH-004",
      "evidenceOwner": "ARCHITECTURE_OWNER",
      "parent": "FUN-014",
      "sourceSection": "managed-datasets-operator-ui-design-spec.md#20-acceptance-requirements",
      "category": "ARCH",
      "applicability": "REQUIRED_CORE",
      "minimumConfidenceGrade": 4,
      "primaryCharter": "CH-35",
      "supportingCharters": ["CH-34", "CH-39", "CH-40"],
      "risks": ["R-CONTROL-PLANE-BYPASS", "R-SUPPLY-ROUTE", "R-UI-FALSE-STATE"],
      "oracleIds": ["OR-PG", "OR-RABBIT", "OR-UI", "OR-WORKER-SINK"],
      "releaseGateIds": ["dataset-qualified-core"],
      "evidenceState": {
        "designReviewGate": "G-TEAM-REVIEW-v1",
        "designReviewStatus": "PASS",
        "designEvidenceRefs": ["managed-test-data-readiness-assessment.md#ui-design-review"],
        "implementationGate": "G-M1-INTERNAL-v1",
        "implementationStatus": "NOT_RUN",
        "implementationEvidenceRefs": [],
        "releaseGate": "dataset-qualified-core",
        "releaseStatus": "NOT_RUN",
        "releaseEvidenceRefs": []
      }
    },
    {
      "id": "DSUI-SEM-001",
      "evidenceOwner": "PRODUCT_UX_OWNER",
      "parent": "FUN-014",
      "sourceSection": "managed-datasets-operator-ui-design-spec.md#20-acceptance-requirements",
      "category": "SEM",
      "applicability": "REQUIRED_CORE",
      "minimumConfidenceGrade": 4,
      "primaryCharter": "CH-34",
      "supportingCharters": ["CH-35", "CH-37"],
      "risks": ["R-SSOT-DRIFT", "R-UI-FALSE-STATE"],
      "oracleIds": ["OR-REGISTRY", "OR-UI"],
      "releaseGateIds": ["dataset-qualified-core"],
      "evidenceState": {
        "designReviewGate": "G-TEAM-REVIEW-v1",
        "designReviewStatus": "PASS",
        "designEvidenceRefs": ["managed-test-data-readiness-assessment.md#ui-design-review"],
        "implementationGate": "G-M1-INTERNAL-v1",
        "implementationStatus": "NOT_RUN",
        "implementationEvidenceRefs": [],